{
  "id": "jev-gate-pin",
  "name": "JEV gate + constraint pin",
  "purpose": "Optional PreToolUse-style gate with constraint pin/gather stubs; Fish fixtures target FN=0 on block (cite knowledge pack).",
  "harness": "coordination",
  "created": "2026-09-27",
  "updated": "2026-09-27",
  "owning_issue": "https://github.com/Pukujan/agent-custom-setup/issues/17",
  "owning_agent": "agent-custom-setup",
  "deploy_mirrors": [
    {
      "label": "ACS module tree (SoT; optional opt-in; agents load from checkout)",
      "path": "D:\\\\claude\\\\agent-custom-setup\\\\modules\\\\coordination\\\\jev-gate-pin\\\\v0.1.0\\\\",
      "notes": "ACS is SoT. Optional until proven; not binding in multi-agent-hotload HOTLOAD.md load-order."
    }
  ],
  "version": "0.1.0",
  "title": "JEV gate + constraint pin (optional draft)",
  "path": "modules/coordination/jev-gate-pin/v0.1.0/",
  "recorded_at": "2026-09-27T20:30:00Z",
  "valid_time": {
    "start": "2026-09-27T00:00:00-04:00",
    "end": null
  },
  "status": "draft",
  "files": [
    {
      "path": "README.md",
      "role": "install-overview"
    },
    {
      "path": "BEHAVIOR.md",
      "role": "normative-ops"
    },
    {
      "path": "NOTES.md",
      "role": "operator-notes"
    },
    {
      "path": "module.json",
      "role": "module-metadata"
    },
    {
      "path": "schema/gate_event.schema.json",
      "role": "gate-event-schema"
    },
    {
      "path": "schema/gather_package.schema.json",
      "role": "gather-package-schema"
    },
    {
      "path": "scripts/pin_extract.py",
      "role": "pin-extract-stub"
    },
    {
      "path": "scripts/gather.py",
      "role": "gatherer"
    },
    {
      "path": "scripts/gate.py",
      "role": "gate-cli"
    },
    {
      "path": "scripts/log_event.py",
      "role": "event-logger"
    },
    {
      "path": "fixtures/fish_hosted_vs_selfhost/",
      "role": "fish-fixtures"
    },
    {
      "path": "tests/test_fish_fixtures.py",
      "role": "fixture-tests"
    },
    {
      "path": "tests/test_pin_gather.py",
      "role": "unit-tests"
    }
  ],
  "secrets_policy": {
    "never_commit": [
      "API keys",
      "tokens",
      "cookies",
      ".env file contents",
      "bak files"
    ],
    "runtime_secret_locations": [],
    "repo_rule": "Docs, schemas, stubs, and fixtures only. No secrets. Mock judge for CI."
  },
  "dependencies": [
    "Knowledge pack docs/knowledge/jev-architecture-gate-pin-compaction-fish.md (id acs-jev-architecture-gate-pin-compaction-fish); issues #15 / PR #16",
    "Complementary to #13/#14 external research checklist (not a replacement)",
    "Python 3 stdlib for stubs; pytest optional for tests"
  ],
  "summary": "Draft optional module: pin extract + gatherer tiny package + PreToolUse-style allow/deny/escalate gate (mock judge default) + Fish hosted-vs-selfhost fixtures (FN=0 on block) + JSONL event log. Not binding hotload until proven."
}
