{
  "id": "multi-agent-hotload",
  "name": "Multi-agent hotload coordination",
  "purpose": "Install surface: hot-load the FULL stack — PCM (continuity + GitHub governance), CGM 0.5.12 (eight modules + human_output_contract), and OIO (observational issue-log surface) — plus the coordination runtime (join-order roles, 30m-default boss lease, claim-file FIFO claim queue (executed by scripts/seat_protocol.py), agent-less ~10m watchdog, proposals/claim/PR). Every component comes from the same agent-stack-train checkout, at its one commit.",
  "harness": "coordination",
  "created": "2026-09-27",
  "updated": "2026-10-05",
  "owning_issue": "https://github.com/Pukujan/agent-custom-setup/issues/11",
  "owning_agent": "agent-custom-setup",
  "deploy_mirrors": [
    {
      "label": "ACS module tree (SoT; agents load from checkout)",
      "path": "modules/coordination/multi-agent-hotload/v0.1.0/",
      "notes": "ACS is SoT. Repo-relative on purpose: the same pack runs on Windows, macOS, and Linux. No Desktop launcher mirror required."
    }
  ],
  "version": "0.1.0",
  "title": "Multi-agent hotload coordination pack",
  "path": "modules/coordination/multi-agent-hotload/v0.1.0/",
  "recorded_at": "2026-10-05T00:00:00Z",
  "valid_time": {
    "start": "2026-09-27T00:00:00-04:00",
    "end": null
  },
  "status": "active",
  "files": [
    {
      "path": "README.md",
      "role": "install-overview"
    },
    {
      "path": "HOTLOAD.md",
      "role": "startup-load-order"
    },
    {
      "path": "SPEC.md",
      "role": "install-contract-normative"
    },
    {
      "path": "PROMPT_INJECT.md",
      "role": "acs-prompt-inject"
    },
    {
      "path": "ROLES.md",
      "role": "boss-worker-rules"
    },
    {
      "path": "BEHAVIOR.md",
      "role": "normative-ops"
    },
    {
      "path": "PROPOSALS.md",
      "role": "propose-accept-claim-flow"
    },
    {
      "path": "NOTES.md",
      "role": "operator-notes"
    },
    {
      "path": "module.json",
      "role": "module-metadata"
    },
    {
      "path": "pins.json",
      "role": "module-shape-only"
    },
    {
      "path": "schema/assignment.schema.json",
      "role": "assignment-schema"
    },
    {
      "path": "examples/assignment.example.json",
      "role": "assignment-example"
    },
    {
      "path": "scripts/acs_install.py",
      "role": "installer-conductor"
    },
    {
      "path": "scripts/hotload_check.py",
      "role": "validator"
    },
    {
      "path": "scripts/check_pins.py",
      "role": "pack-pin-drift-check"
    },
    {
      "path": "scripts/watchdog_check.py",
      "role": "agentless-watchdog"
    },
    {
      "path": "scripts/seat_protocol.py",
      "role": "seat-runtime"
    },
    {
      "path": "scripts/dev_root_check.py",
      "role": "dev-root-hygiene-check"
    },
    {
      "path": "workflow-stubs/watchdog.yml",
      "role": "gh-action-stub"
    },
    {
      "path": "formal/install.tla",
      "role": "formal-state-machine"
    },
    {
      "path": "formal/install.cfg",
      "role": "formal-model-config"
    },
    {
      "path": "formal/seat.tla",
      "role": "formal-state-machine"
    },
    {
      "path": "formal/seat.cfg",
      "role": "formal-model-config"
    },
    {
      "path": "formal/README.md",
      "role": "formal-run-notes"
    },
    {
      "path": "holdouts/HLD-0001-blind-rubric.md",
      "role": "hidden-holdout-rubric"
    },
    {
      "path": "tests/test_acs_install.py",
      "role": "tests"
    },
    {
      "path": "tests/test_install_acceptance.py",
      "role": "tests-pdd"
    },
    {
      "path": "tests/test_install_states.py",
      "role": "tests-sdd"
    },
    {
      "path": "tests/test_install_gates.py",
      "role": "tests-tdd"
    },
    {
      "path": "tests/test_install_metamorphic.py",
      "role": "tests-metamorphic"
    },
    {
      "path": "tests/test_install_manifest.py",
      "role": "tests-differential-offline"
    },
    {
      "path": "tests/test_train_parity.py",
      "role": "tests-differential-live"
    },
    {
      "path": "tests/test_hotload_check.py",
      "role": "tests"
    },
    {
      "path": "tests/test_check_pins.py",
      "role": "tests"
    },
    {
      "path": "tests/test_dev_root_check.py",
      "role": "tests"
    },
    {
      "path": "tests/test_coordination.py",
      "role": "tests-protocol"
    },
    {
      "path": "tests/test_coordination_failures.py",
      "role": "tests-failure-paths"
    }
  ],
  "secrets_policy": {
    "never_commit": [
      "API keys",
      "tokens",
      "cookies",
      ".env file contents",
      "bak files"
    ],
    "runtime_secret_locations": [],
    "repo_rule": "Docs, schemas, and agent-less stubs only. No secrets."
  },
  "dependencies": [
    "PCM from the agent-stack-train checkout's pcm/ folder, at the stack commit — FULL stack: continuity + PR-only + required CI + branch protection/auto-merge preference; pin/reference, do not vendor",
    "CGM from the agent-stack-train checkout's cgm/ folder, at the stack commit — FULL eight-module stack (incl. human-output-naming) + human_output_contract; not HSW+writing-direction only; pin/reference, do not vendor",
    "OIO from the agent-stack-train checkout's oio/ folder, at the stack commit — the observational issue-log surface (ontology, issue form, triage workflow, AGENTS.md guidance block); the ACS installer invokes OIO's own installer; pin/reference, do not vendor",
    "agent-stack-train stack-releases.json — the certified version set the adopter's stack-manifest.json follows (empty pins)",
    "Python 3 + jsonschema for hotload_check"
  ],
  "summary": "Hot-load the FULL stack (PCM + CGM 0.5.12 + OIO) + this runtime. Every component comes from one agent-stack-train checkout, at one commit; the adopter's stack-manifest.json carries an empty agent-stack-train pin and follows the train. The installer is a gated conductor: it classifies every existing path, refuses to clobber foreign/edited content, and reports a PARTIAL install (never a fake OK) when a component such as OIO cannot be installed. Join order fills roles. Boss lease default 30m (15–120). claim-file claim_queue after vacancy (scripts/seat_protocol.py executes the seat state machine); returning boss joins end. Agent-less watchdog ~10m. Slim subsets are incomplete installs."
}
